smartctl 7.0 2018-12-30 r4883 [x86_64-linux-4.9.76-gentoo-r1] (local build)
Copyright (C) 2002-18, Bruce Allen, Christian Franke, www.smartmontools.org

=== START OF READ SMART DATA SECTION ===
SMART Attributes Data Structure revision number: 1
Vendor Specific SMART Attributes with Thresholds:
ID# ATTRIBUTE_NAME          FLAG     VALUE WORST THRESH TYPE      UPDATED  WHEN_FAILED RAW_VALUE
  5 Reallocated_Sector_Ct   0x0033   100   100   010    Pre-fail  Always       -       0
  9 Power_On_Hours          0x0032   096   096   000    Old_age   Always       -       19375
 12 Power_Cycle_Count       0x0032   099   099   000    Old_age   Always       -       21
177 Wear_Leveling_Count     0x0013   098   098   000    Pre-fail  Always       -       31
179 Used_Rsvd_Blk_Cnt_Tot   0x0013   100   100   010    Pre-fail  Always       -       0
181 Program_Fail_Cnt_Total  0x0032   100   100   010    Old_age   Always       -       0
182 Erase_Fail_Count_Total  0x0032   100   100   010    Old_age   Always       -       0
183 Runtime_Bad_Block       0x0013   100   100   010    Pre-fail  Always       -       0
187 Uncorrectable_Error_Cnt 0x0032   100   100   000    Old_age   Always       -       0
190 Airflow_Temperature_Cel 0x0032   072   047   000    Old_age   Always       -       28
195 ECC_Error_Rate          0x001a   200   200   000    Old_age   Always       -       0
199 CRC_Error_Count         0x003e   099   099   000    Old_age   Always       -       81
235 POR_Recovery_Count      0x0012   099   099   000    Old_age   Always       -       7
241 Total_LBAs_Written      0x0032   099   099   000    Old_age   Always       -       40721286123

